{"being_ref":"dm:being:v1:VlG-k1yMoEXlpk0GvxVCALmpTlFp7GizcHzt3hPcQQs","control_head":"dm:identity:v1:Nca5Hlx-dWYGgzJap1H82V4VJTwKDbGOufJ0_-8-Lys","embodiments":[{"body_ref":"cluster:legion:compaii","embodiment_credential_id":"dm:identity:v1:PWGfpIKl4W35tjo7YIzACT4Wnpb49ydFlqdUHs1h8wk","embodiment_id":"embodiment:vector:legion","incarnation_authorization_id":"dm:identity:v1:6FzUg3ciNHWVS9ggfDMyAW5jpHmnxl7fEAGA2taQsmY","incarnation_id":"incarnation:vector:legion:0","status":"retired"},{"body_ref":"cluster:legion:compaii","embodiment_credential_id":"dm:identity:v1:PWGfpIKl4W35tjo7YIzACT4Wnpb49ydFlqdUHs1h8wk","embodiment_id":"embodiment:vector:legion","incarnation_authorization_id":"dm:identity:v1:mbQdfFC5rCYNUv-4e8YE2ZpE_uJWTQyeW7QqBXi03rg","incarnation_id":"incarnation:vector:legion:1","status":"active"}],"history_binding_id":null,"revision":2,"schema":"being-manifest/v2"}
