{"being_ref":"dm:being:v1:VlG-k1yMoEXlpk0GvxVCALmpTlFp7GizcHzt3hPcQQs","control_head":"dm:identity:v1:Xo41RRCziu7PoNMJwG_BADyk_zeE83iL6vVRTRrR_L0","embodiments":[{"body_ref":"cluster:vector:recovered","embodiment_credential_id":"dm:identity:v1:EG2rtk1iQSd24RI7lkGsSZ2z-nUD0j-Zk7ATI8Vi-DE","embodiment_id":"embodiment:vector:recovered","incarnation_authorization_id":"dm:identity:v1:WXXqiHGr9AWMbBCLjlRDnCKiTij0Sl_9xLaaitx54so","incarnation_id":"incarnation:vector:recovered:0","status":"active"}],"history_binding_id":null,"revision":2,"schema":"being-manifest/v2"}
