{"being_ref":"dm:being:v1:VlG-k1yMoEXlpk0GvxVCALmpTlFp7GizcHzt3hPcQQs","control_head":"dm:identity:v1:TqjzPtnRSNUW8q3HjD6YhyGIv87AcReaX3aUkf5qqb0","embodiments":[{"body_ref":"cluster:legion:compaii","embodiment_credential_id":"dm:identity:v1:PWGfpIKl4W35tjo7YIzACT4Wnpb49ydFlqdUHs1h8wk","embodiment_id":"embodiment:vector:legion","incarnation_authorization_id":"dm:identity:v1:6FzUg3ciNHWVS9ggfDMyAW5jpHmnxl7fEAGA2taQsmY","incarnation_id":"incarnation:vector:legion:0","status":"retired"}],"history_binding_id":null,"revision":2,"schema":"being-manifest/v2"}
